[
    {
        "name": "Macchiato",
        "subname": "Single",
        "shotTime": 24,
        "cupSize": 100,
        "ingredients": [
            {
                "milk": true,
                "amount": [
                    {
                        "foamAmount": 10
                    }
                ]
            }
        ],
        "instruction": [
            {
                "stepOne": "Extract single shot of coffee.",
                "stepTwo": "Steam milk.",
                "stepThree": "Add few spoons of foam on a top."
            }
        ]
    },
    {
        "name": "Macchiato",
        "subname": "Double",
        "shotTime": 24,
        "cupSize": 150,
        "ingredients": [
            {
                "milk": true,
                "amount": [
                    {
                        "foamAmount": 10
                    }
                ]
            }
        ],
        "instruction": [
            {
                "stepOne": "Extract double shot of coffee.",
                "stepTwo": "Steam milk.",
                "stepThree": "Add few spoons of foam on a top."
            }
        ]
    },
    {
        "name": "Ristretto",
        "shotTime": 17,
        "cupSize": 100,
        "instruction": [
            {
                "stepOne": "When extraction double shot of coffee press a button stop after 17 seconds."
            }
        ]
    },
    {
        "name": "Americano",
        "subname": "Black",
        "shotTime": 24,
        "cupSize": 300,
        "ingredients": [
            {
                "water": true,
                "amount": 70
            }
        ],
        "instruction": [
            {
                "stepOne": "Extract double shot of coffee.",
                "stepTwo": "Add hot water."
            }
        ]
    },
    {
        "name": "Americano",
        "subname": "White",
        "shotTime": 24,
        "cupSize": 300,
        "ingredients": [
            {
                "water": true,
                "amount": 70
            },
            {
                "milk": true,
                "amount": [
                    {
                        "milkAmount": 5
                    }
                ]
            }
        ],
        "instruction": [
            {
                "stepOne": "Extract double shot of coffee.",
                "stepTwo": "Add hot water.",
                "stepThree": "Add splash of hot milk."
            }
        ]
    },
    {
        "name": "Latte",
        "shotTime": 24,
        "cupSize": 300,
        "ingredients": [
            {
                "milk": true,
                "amount": [
                    {
                        "milkAmount": 50,
                        "foamAmount": 20
                    }
                ]
            },
            {
                "additionalIngredients": [
                    "syrops",
                    "cinnamon"
                ]
            }
        ],
        "instruction": [
            {
                "stepOne": "Extract double shot of coffee.",
                "stepTwo": "Steam milk, leaving a steamer on a top for 3 seconds.",
                "stepThree": "Pour milk in a cup and after slowly add a shot of coffee."
            }
        ],
        "coffeeArt": true
    },
    {
        "name": "Cappuccino",
        "shotTime": 24,
        "cupSize": 300,
        "ingredients": [
            {
                "milk": true,
                "amount": [
                    {
                        "milkAmount": 20,
                        "foamAmount": 50
                    }
                ]
            },
            {
                "additionalIngredients": [
                    "syrops",
                    "chocolate"
                ]
            }
        ],
        "instruction": [
            {
                "stepOne": "Extract double shot of coffee.",
                "stepTwo": "Steam milk, leaving a steamer on a top for 10 seconds.",
                "stepThree": "Add steamed milk in a cup with a shot."
            }
        ],
        "coffeeArt": true
    },
    {
        "name": "Mocha",
        "shotTime": 24,
        "cupSize": 300,
        "ingredients": [
            {
                "milk": true,
                "amount": [
                    {
                        "milkAmount": 50,
                        "foamAmount": 20
                    }
                ]
            },
            {
                "chocolate": true,
                "amount": 2
            },
            {
                "additionalIngredients": [
                    "syrops",
                    "marshmallows"
                ]
            }
        ],
        "instruction": [
            {
                "stepOne": "Extract double shot of coffee and mix it with chocolate until it dissolves.",
                "stepTwo": "Steam milk, leaving a steamer on a top for 3 seconds.",
                "stepThree": "Pour milk in a cup with coffee and chocolate."
            }
        ],
        "coffeeArt": true
    }
]